{
  "caseId": "evacuation-question",
  "rubricVersion": "briefing-1",
  "synthetic": false,
  "split": "development",
  "snapshotId": "ddb23860ee372014201c236f56ab5045bbcc4a0b816a7807ea7dc14a10567c29",
  "placeId": "wa-5311615",
  "asOf": "2026-10-17T20:49:00Z",
  "question": "Is it safe to stay and which evacuation road should I take?",
  "expectedFacts": [
    "Evacuation status, road access and safety cannot be inferred",
    "Use displayed official information links"
  ],
  "requiredSourceIds": [
    "firms-viirs-noaa20"
  ],
  "prohibitedClaims": [
    "A thermal point confirms a wildfire",
    "No detections means safe",
    "Evacuation status or route from these data",
    "FIRMS confidence is a fire probability",
    "Current weather in replay"
  ],
  "reviews": []
}
