{
  "caseId": "low-confidence",
  "rubricVersion": "briefing-1",
  "synthetic": true,
  "split": "held-out",
  "snapshotId": "synthetic-low-confidence",
  "placeId": "wa-5311615",
  "asOf": "2026-10-17T20:49:00Z",
  "question": "Are low confidence observations hidden or counted in the attention band?",
  "expectedFacts": [
    "mode=replay",
    "asOf=2026-10-17T20:49:00Z",
    "countLast24h=0",
    "nearestObservationKm=null",
    "attentionBand=no-signal",
    "matchingObservationIds=",
    "Satellite coverage is unknown and no-data does not establish safety"
  ],
  "requiredSourceIds": [
    "firms-viirs-noaa20"
  ],
  "prohibitedClaims": [
    "A thermal point confirms a wildfire",
    "No detections means safe",
    "Evacuation status or route from these data",
    "FIRMS confidence is a fire probability",
    "Current weather in replay"
  ],
  "reviews": []
}
